{
  "allowed_kb": [
    "urn:fxsl:kb:seven-sketches",
    "urn:fxsl:kb:coalgebras",
    "urn:fxsl:kb:cognitive-toolkit",
    "urn:fxsl:kb:categorical-data-structures"
  ],
  "sandbox": {
    "mode": "permissive"
  },
  "tools": {
    "allow": ["catalog_resolve", "kb_route", "web_search"],
    "deny": []
  },
  "sub_agents": {
    "max_depth": 1,
    "max_concurrent": 2
  }
}
