{
  "allowed_kb": [
    "urn:gn:kb:gestion-prpto",
    "urn:gn:kb:ley-presupuestos-2026-partida-31",
    "urn:gn:kb:gestion-ipr",
    "urn:gn:kb:gestion-rendiciones",
    "urn:gn:kb:estrategia-gestion",
    "urn:gn:kb:aceleracion-regional",
    "urn:gn:kb:erd-nuble-2024-2030",
    "urn:gn:kb:nuble-250",
    "urn:gn:kb:gore-ideal",
    "urn:gn:kb:selector-ipr",
    "urn:gn:kb:problemas-sociales-cl",
    "urn:gn:kb:gestion-info-geoespacial",
    "urn:gn:kb:cies-sitia",
    "urn:gn:kb:indicadores-nuble"
  ],
  "sandbox": {
    "mode": "strict"
  },
  "tools": {
    "allow": ["catalog_resolve", "kb_route"],
    "deny": []
  },
  "sub_agents": {
    "max_depth": 1,
    "max_concurrent": 2
  }
}
