{
  "_manifest": {
    "urn": "urn:fxsl:agent-bootstrap:arquitecto-orko-config:2.0.0",
    "type": "bootstrap_config"
  },
  "allowed_kb": [
    "urn:orko:kb:orko-fundamentos",
    "urn:orko:kb:orko-arquitectura",
    "urn:orko:kb:orko-tejidos",
    "urn:orko:kb:orko-metodologia",
    "urn:orko:kb:orko-toolkit",
    "urn:orko:kb:impl-orko-toolkit"
  ],
  "sandbox": {
    "mode": "strict"
  },
  "tools": {
    "allow": [
      "catalog_resolve",
      "kb_route"
    ]
  },
  "sub_agents": {
    "max_depth": 0,
    "max_concurrent": 1
  }
}
