{
  "allowed_kb": [
    "urn:kora:kb:agent-spec-md",
    "urn:kora:kb:spec-md",
    "urn:kora:kb:md-spec",
    "urn:kora:kb:hub-agentes",
    "urn:kora:kb:workflow-wikiguias"
  ],
  "sandbox": {
    "mode": "strict"
  },
  "tools": {
    "allow": ["catalog_resolve", "kb_route"],
    "deny": []
  },
  "sub_agents": {
    "max_depth": 1,
    "max_concurrent": 2
  }
}
