{
  "_manifest": {
    "urn": "urn:gn:agent-bootstrap:asesor-juridico-config:2.0.0",
    "type": "bootstrap_config"
  },
  "allowed_kb": [
    "urn:gn:kb:organigrama",
    "urn:gn:kb:flujos-aprobacion-documentos",
    "urn:gn:kb:modelos-actos-juridicos",
    "urn:gn:kb:gestion-rendiciones",
    "urn:gn:kb:loc-gore",
    "urn:gn:kb:marco-legal-gores",
    "urn:gn:kb:dictamenes-cgr-gore",
    "urn:gn:kb:gestion-ipr",
    "urn:gn:kb:guia-circular-33-sts",
    "urn:gn:kb:transferencia-ppr",
    "urn:gn:kb:selector-ipr",
    "urn:gn:kb:gestion-prpto",
    "urn:gn:kb:ley-presupuestos-2026-partida-31",
    "urn:gn:kb:estrategia-gestion",
    "urn:gn:kb:cuentas-publicas-2021-2024",
    "urn:gn:kb:ley-presupuestos-2026-glosas-gore",
    "urn:gn:kb:bpmn-actos-administrativos",
    "urn:gn:kb:convenios-estados-fases",
    "urn:gn:kb:ecosistema-instituciones"
  ],
  "sandbox": {
    "mode": "strict"
  },
  "tools": {
    "allow": [
      "catalog_resolve",
      "kb_route"
    ]
  },
  "sub_agents": {
    "max_depth": 1,
    "max_concurrent": 2
  }
}
