{
  "_manifest": {
    "urn": "urn:pro:agent-bootstrap:medico-urgencias-config:2.0.0",
    "type": "bootstrap_config"
  },
  "allowed_kb": [],
  "sandbox": {
    "mode": "strict"
  },
  "tools": {
    "allow": [
      "analyze_image",
      "parse_clinical_input"
    ],
    "deny": []
  },
  "sub_agents": {
    "max_depth": 0,
    "max_concurrent": 1
  },
  "runtime_capabilities": {
    "allow": [],
    "deny": [
      "web_search",
      "code_execution"
    ]
  }
}
