{
  "allowed_kb": [
    "urn:kora:kb:test-strategy",
    "urn:kora:kb:agent-spec-md"
  ],
  "sandbox": {
    "mode": "strict"
  },
  "tools": {
    "allow": ["catalog_resolve", "kb_route", "delegate_tester"],
    "deny": []
  },
  "sub_agents": {
    "max_depth": 1,
    "max_concurrent": 1,
    "fleet": [
      {
        "id": "TESTER",
        "role": "Generator tests + evaluator",
        "source": "urn:kora:agent:tester:1.0.0",
        "instantiation": "STATIC"
      },
      {
        "id": "TARGET",
        "role": "Agente testeado",
        "source": "dynamic:from_user_yaml",
        "instantiation": "DYNAMIC"
      }
    ]
  }
}
