{
  "_manifest": {
    "urn": "urn:gn:agent-bootstrap:arquitecto-automatizacion-organizacional-config:1.0.0",
    "type": "bootstrap_config"
  },
  "allowed_kb": [],
  "sandbox": {
    "mode": "permissive"
  },
  "tools": {
    "allow": [
      "artifact_generate",
      "catalog_resolve",
      "kb_route",
      "web_search"
    ],
    "deny": []
  },
  "sub_agents": {
    "max_depth": 1,
    "max_concurrent": 2
  },
  "runtime_capabilities": {
    "allow": [],
    "deny": []
  }
}
