{
  "allowed_kb": [
    "urn:gn:kb:vision-desarrollo-nuble",
    "urn:gn:kb:gore-ideal",
    "urn:gn:kb:aceleracion-regional",
    "urn:gn:kb:erd-nuble-2024-2030",
    "urn:gn:kb:intro-gores-nuble",
    "urn:mgmt:kb:estructura-estado-chile",
    "urn:gn:kb:guia-comunicaciones",
    "urn:gn:kb:estrategia-td-ia",
    "urn:gn:kb:informe-estado-inicial-gore-pre-td",
    "urn:gn:kb:indicadores-nuble"
  ],
  "sandbox": {
    "mode": "strict"
  },
  "tools": {
    "allow": ["catalog_resolve", "kb_route"],
    "deny": []
  },
  "sub_agents": {
    "max_depth": 1,
    "max_concurrent": 2
  }
}
