{
  "_manifest": {
    "urn": "urn:gn:agent-bootstrap:gobernador-virtual-config:2.0.0",
    "type": "bootstrap_config"
  },
  "allowed_kb": [
    "urn:gn:kb:estructura-estado-chile",
    "urn:gn:kb:loc-gore",
    "urn:gn:kb:intro-gores-nuble",
    "urn:gn:kb:marco-legal-gores",
    "urn:gn:kb:erd-nuble-2024-2030",
    "urn:gn:kb:nuble-250",
    "urn:gn:kb:gore-ideal",
    "urn:gn:kb:gestion-prpto",
    "urn:gn:kb:ley-presupuestos-2026-partida-31",
    "urn:gn:kb:gestion-ipr",
    "urn:gn:kb:cuentas-publicas-2021-2024",
    "urn:gn:kb:estrategia-gestion",
    "urn:gn:kb:flujos-aprobacion-documentos",
    "urn:gn:kb:vision-desarrollo-nuble",
    "urn:gn:kb:guia-comunicaciones",
    "urn:gn:kb:comunicaciones-oc"
  ],
  "sandbox": {
    "mode": "strict"
  },
  "tools": {
    "allow": [
      "catalog_resolve",
      "kb_route"
    ]
  },
  "sub_agents": {
    "max_depth": 1,
    "max_concurrent": 2
  }
}
