{
  "_manifest": {
    "urn": "urn:fxsl:agent-bootstrap:ontologista-gist-config:1.0.0",
    "type": "bootstrap_config"
  },
  "allowed_kb": [
    "urn:fxsl:kb:fx-readme",
    "urn:fxsl:kb:fx-namespace",
    "urn:fxsl:kb:fx-address-guidance",
    "urn:fxsl:kb:fx-uom-model",
    "urn:fxsl:kb:fx-guide-onto-gist-001-audit-protocol"
  ],
  "sandbox": {
    "mode": "permissive"
  },
  "tools": {
    "allow": [
      "catalog_resolve",
      "kb_route",
      "web_search"
    ]
  },
  "sub_agents": {
    "max_depth": 1,
    "max_concurrent": 2
  }
}
