{
  "_manifest": {
    "urn": "urn:gn:agent-bootstrap:dgi-virtual-config:1.0.0",
    "type": "bootstrap_config"
  },
  "allowed_kb": [
    "urn:gn:kb:estructura-estado-chile",
    "urn:gn:kb:loc-gore",
    "urn:gn:kb:intro-gores-nuble",
    "urn:gn:kb:flujos-aprobacion-documentos",
    "urn:gn:kb:gestion-prpto",
    "urn:gn:kb:erd-nuble-2024-2030",
    "urn:tde:kb:guia-metodologica-sistema-transformacion-digital-2025",
    "urn:tde:kb:ley-21180-transformacion-digital-estado",
    "urn:gn:kb:manual-operacional-dgi",
    "urn:gn:kb:plan-potenciamiento-dgi",
    "urn:gn:kb:meyer-estructura-organizacional",
    "urn:gn:kb:lean6-gestion-core",
    "urn:gn:kb:modernizacion-estado-waissbluth",
    "urn:gn:kb:bpmn-actos-administrativos",
    "urn:gn:kb:bpmn-cies-sitia",
    "urn:gn:kb:bpmn-geoespacial-ide"
  ],
  "sandbox": {
    "mode": "strict"
  },
  "tools": {
    "allow": [
      "catalog_resolve",
      "kb_route"
    ]
  },
  "sub_agents": {
    "max_depth": 0,
    "max_concurrent": 1
  },
  "runtime_capabilities": {
    "deny": [
      "web_search"
    ]
  }
}
