{
  "_manifest": {
    "urn": "urn:kora:agent-bootstrap:guardian-config:1.0.0",
    "type": "bootstrap_config"
  },
  "allowed_kb": [
    "urn:kora:kb:gobernanza",
    "urn:kora:kb:spec-md",
    "urn:kora:kb:md-spec",
    "urn:kora:kb:agent-spec-md",
    "urn:kora:kb:skill-spec-md",
    "urn:kora:kb:runtime-spec-md",
    "urn:kora:kb:swarm-spec-md",
    "urn:agengai:kb:openclaw-runtime-extension"
  ],
  "sandbox": {
    "mode": "strict"
  },
  "tools": {
    "allow": [
      "kb_route",
      "repo_health",
      "spec_consult"
    ],
    "deny": []
  },
  "runtime_capabilities": {
    "allow": [],
    "deny": [
      "filesystem_write",
      "deploy"
    ]
  },
  "sub_agents": {
    "max_depth": 0
  }
}
