{
  "_manifest": {
    "urn": "urn:ops:agent-bootstrap:ci-assistant-config:1.0.0",
    "type": "bootstrap_config"
  },
  "allowed_kb": [
    "urn:kora:kb:hub-agentes",
    "urn:kora:kb:test-strategy",
    "urn:kora:kb:agent-spec-md"
  ],
  "sandbox": {
    "mode": "permissive"
  },
  "tools": {
    "allow": [
      "catalog_resolve",
      "kb_route",
      "web_search"
    ]
  },
  "sub_agents": {
    "max_depth": 0,
    "max_concurrent": 1
  }
}
